{
  "$schema": "https://json-schema.org/draft/2020-12/schema",
  "$id": "https://jp-learner/content.schema.json",
  "title": "JP-Learner class content",
  "type": "object",
  "required": ["schemaVersion", "classId", "date", "label"],
  "additionalProperties": false,
  "properties": {
    "schemaVersion": { "const": 1 },
    "classId": { "type": "string", "pattern": "^\\d{4}-\\d{2}-\\d{2}(-\\d+)?$" },
    "date":    { "type": "string", "format": "date" },
    "label":   { "type": "string", "minLength": 1 },
    "vocab":   { "type": "array", "items": { "$ref": "#/$defs/vocab" },   "default": [] },
    "grammar": { "type": "array", "items": { "$ref": "#/$defs/grammar" }, "default": [] },
    "kanji":   { "type": "array", "items": { "$ref": "#/$defs/kanji" },   "default": [] },
    "notes":   { "type": "array", "items": { "$ref": "#/$defs/note" },    "default": [] }
  },
  "$defs": {
    "token": {
      "type": "object",
      "required": ["surface", "reading", "isKanji"],
      "additionalProperties": false,
      "properties": {
        "surface": { "type": "string", "minLength": 1 },
        "reading": { "type": "string", "minLength": 1 },
        "isKanji": { "type": "boolean" },
        "kanji":   { "type": "array", "items": { "type": "string", "minLength": 1, "maxLength": 1 } }
      }
    },
    "sentence": {
      "type": "object",
      "required": ["kanji", "kana", "romaji", "es"],
      "additionalProperties": false,
      "properties": {
        "kanji":  { "type": "string" },
        "kana":   { "type": "string" },
        "romaji": { "type": "string" },
        "es":     { "type": "string" },
        "tokens": { "type": "array", "items": { "$ref": "#/$defs/token" } }
      }
    },
    "vocab": {
      "type": "object",
      "required": ["id", "type", "kanji", "kana", "romaji", "es", "tokens", "tags"],
      "additionalProperties": false,
      "properties": {
        "id":     { "type": "string", "pattern": "^[^:]+:vocab:.+$" },
        "type":   { "const": "vocab" },
        "kanji":  { "type": "string", "minLength": 1 },
        "kana":   { "type": "string", "minLength": 1 },
        "romaji": { "type": "string", "minLength": 1 },
        "es":     { "type": "string", "minLength": 1 },
        "pos":    { "type": "string" },
        "tokens": { "type": "array", "minItems": 1, "items": { "$ref": "#/$defs/token" } },
        "example":{ "$ref": "#/$defs/sentence" },
        "tags":   { "type": "array", "items": { "type": "string" }, "minItems": 1 }
      }
    },
    "grammar": {
      "type": "object",
      "required": ["id", "type", "pattern", "es", "examples", "tags"],
      "additionalProperties": false,
      "properties": {
        "id":       { "type": "string", "pattern": "^[^:]+:grammar:.+$" },
        "type":     { "const": "grammar" },
        "pattern":  { "type": "string", "minLength": 1 },
        "es":       { "type": "string", "minLength": 1 },
        "examples": { "type": "array", "minItems": 1, "items": { "$ref": "#/$defs/sentence" } },
        "tags":     { "type": "array", "items": { "type": "string" }, "minItems": 1 }
      }
    },
    "kanji": {
      "type": "object",
      "required": ["id", "type", "char", "readings", "es", "seenIn"],
      "additionalProperties": false,
      "properties": {
        "id":       { "type": "string", "pattern": "^[^:]+:kanji:.+$" },
        "type":     { "const": "kanji" },
        "char":     { "type": "string", "minLength": 1, "maxLength": 1 },
        "readings": {
          "type": "object", "additionalProperties": false,
          "properties": {
            "on":  { "type": "array", "items": { "type": "string" } },
            "kun": { "type": "array", "items": { "type": "string" } }
          }
        },
        "es":     { "type": "string", "minLength": 1 },
        "seenIn": { "type": "array", "items": { "type": "string" } }
      }
    },
    "note": {
      "type": "object",
      "required": ["id", "type", "es", "tags"],
      "additionalProperties": false,
      "properties": {
        "id":   { "type": "string", "pattern": "^[^:]+:note:.+$" },
        "type": { "const": "note" },
        "es":   { "type": "string", "minLength": 1 },
        "tags": { "type": "array", "items": { "type": "string" }, "minItems": 1 }
      }
    }
  }
}
