{
  "schemaVersion": 1,
  "classId": "2026-04-14",
  "date": "2026-04-14",
  "label": "Clase 1 — presentaciones y verbos -masu",
  "vocab": [
    {
      "id": "2026-04-14:vocab:tabemasu",
      "type": "vocab",
      "kanji": "食べます", "kana": "たべます", "romaji": "tabemasu",
      "es": "comer (cortés)", "pos": "verbo",
      "tokens": [
        { "surface": "食",   "reading": "た",   "isKanji": true,  "kanji": ["食"] },
        { "surface": "べます","reading": "べます","isKanji": false }
      ],
      "example": {
        "kanji": "毎日ご飯を食べます。", "kana": "まいにちごはんをたべます。",
        "romaji": "Mainichi gohan o tabemasu.", "es": "Como arroz todos los días."
      },
      "tags": ["2026-04-14", "verbo", "-masu"]
    },
    {
      "id": "2026-04-14:vocab:norikomu",
      "type": "vocab",
      "kanji": "乗り込む", "kana": "のりこむ", "romaji": "norikomu",
      "es": "subir a bordo / abordar", "pos": "verbo",
      "tokens": [
        { "surface": "乗", "reading": "の", "isKanji": true,  "kanji": ["乗"] },
        { "surface": "り", "reading": "り", "isKanji": false },
        { "surface": "込", "reading": "こ", "isKanji": true,  "kanji": ["込"] },
        { "surface": "む", "reading": "む", "isKanji": false }
      ],
      "example": {
        "kanji": "電車に乗り込む。", "kana": "でんしゃにのりこむ。",
        "romaji": "Densha ni norikomu.", "es": "Subir al tren.",
        "tokens": [
          { "surface": "電車", "reading": "でんしゃ", "isKanji": true, "kanji": ["電", "車"] },
          { "surface": "に", "reading": "に", "isKanji": false },
          { "surface": "乗", "reading": "の", "isKanji": true, "kanji": ["乗"] },
          { "surface": "り", "reading": "り", "isKanji": false },
          { "surface": "込", "reading": "こ", "isKanji": true, "kanji": ["込"] },
          { "surface": "む", "reading": "む", "isKanji": false },
          { "surface": "。", "reading": "。", "isKanji": false }
        ]
      },
      "tags": ["2026-04-14", "verbo"]
    },
    {
      "id": "2026-04-14:vocab:mainichi",
      "type": "vocab",
      "kanji": "毎日", "kana": "まいにち", "romaji": "mainichi",
      "es": "todos los días", "pos": "sustantivo",
      "tokens": [
        { "surface": "毎日", "reading": "まいにち", "isKanji": true, "kanji": ["毎", "日"] }
      ],
      "example": {
        "kanji": "毎日日本語を勉強します。", "kana": "まいにちにほんごをべんきょうします。",
        "romaji": "Mainichi nihongo o benkyou shimasu.", "es": "Estudio japonés todos los días."
      },
      "tags": ["2026-04-14", "tiempo"]
    },
    {
      "id": "2026-04-14:vocab:hon",
      "type": "vocab",
      "kanji": "本", "kana": "ほん", "romaji": "hon",
      "es": "libro", "pos": "sustantivo",
      "tokens": [
        { "surface": "本", "reading": "ほん", "isKanji": true, "kanji": ["本"] }
      ],
      "example": {
        "kanji": "本を読みます。", "kana": "ほんをよみます。",
        "romaji": "Hon o yomimasu.", "es": "Leo un libro."
      },
      "tags": ["2026-04-14", "sustantivo"]
    },
    {
      "id": "2026-04-14:vocab:arigatou",
      "type": "vocab",
      "kanji": "ありがとう", "kana": "ありがとう", "romaji": "arigatou",
      "es": "gracias", "pos": "expresión",
      "tokens": [
        { "surface": "ありがとう", "reading": "ありがとう", "isKanji": false }
      ],
      "example": {
        "kanji": "ありがとうございます。", "kana": "ありがとうございます。",
        "romaji": "Arigatou gozaimasu.", "es": "Muchas gracias."
      },
      "tags": ["2026-04-14", "expresión"]
    }
  ],
  "grammar": [
    {
      "id": "2026-04-14:grammar:masu-form",
      "type": "grammar",
      "pattern": "Verbo + ます",
      "es": "Forma cortés del presente/futuro. Se une a la raíz del verbo.",
      "examples": [
        { "kanji": "行きます", "kana": "いきます", "romaji": "ikimasu", "es": "voy / iré" },
        { "kanji": "飲みます", "kana": "のみます", "romaji": "nomimasu", "es": "bebo / beberé" }
      ],
      "tags": ["2026-04-14", "gramática", "-masu"]
    }
  ],
  "kanji": [
    { "id": "2026-04-14:kanji:食", "type": "kanji", "char": "食",
      "readings": { "on": ["ショク"], "kun": ["た.べる", "く.う"] },
      "es": "comer / comida", "seenIn": ["2026-04-14:vocab:tabemasu"] },
    { "id": "2026-04-14:kanji:乗", "type": "kanji", "char": "乗",
      "readings": { "on": ["ジョウ"], "kun": ["の.る", "の.せる"] },
      "es": "montar / subir", "seenIn": ["2026-04-14:vocab:norikomu"] },
    { "id": "2026-04-14:kanji:本", "type": "kanji", "char": "本",
      "readings": { "on": ["ホン"], "kun": ["もと"] },
      "es": "libro / origen", "seenIn": ["2026-04-14:vocab:hon"] }
  ],
  "notes": [
    { "id": "2026-04-14:note:1", "type": "note",
      "es": "ご en ご飯 es un prefijo honorífico; no cambia el significado, solo la cortesía.",
      "tags": ["2026-04-14"] },
    { "id": "2026-04-14:note:2", "type": "note",
      "es": "La partícula を marca el objeto directo del verbo.",
      "tags": ["2026-04-14"] }
  ]
}
